{
  "schema_version": "lumina/note-work-profile/v0.1",
  "id": "profile-lumina-docs-v0",
  "source": {
    "name": "Lumina Note repository documentation",
    "source_url": "https://github.com/blueberrycongee/Lumina-Note",
    "visibility": "project-committed",
    "license_or_consent": "Project-owned repository documentation; this benchmark uses structural profile data only.",
    "profiled_paths": [
      "README.md",
      "docs/*.md",
      "docs/plans/*.md",
      "packages/plugin-api/README.md",
      "packages/plugin-ui/README.md",
      "mobile/README.md"
    ],
    "profiled_at": "2026-05-31"
  },
  "profile_summary": "Product docs and planning notes mix user guides, design plans, plugin contracts, runtime setup, release notes, and incident reports.",
  "note_counts": {
    "markdown_files_profiled": 70,
    "product_docs": 18,
    "design_or_plan_docs": 35,
    "runtime_docs": 8,
    "localized_guides": 4,
    "reports": 5
  },
  "structure": {
    "folder_taxonomy": [
      "Root README for product overview",
      "docs/ for product and engineering references",
      "docs/plans/ for dated design and implementation plans",
      "packages/*/README.md for plugin API surfaces",
      "mobile/README.md for platform companion notes"
    ],
    "note_type_mix": {
      "concept": "Plugin and runtime concepts are documented as standalone references.",
      "project": "Dated plans track product changes and implementation decisions.",
      "report": "Incident and verification reports capture evidence and follow-up actions.",
      "tutorial": "User flow and setup guides describe repeatable workflows."
    },
    "approximate_note_length": "Short references of 40-120 lines mixed with longer plans and reports over 200 lines.",
    "tag_patterns": [
      "No Obsidian-style tags in source docs; topical headings act as tags.",
      "Date prefixes in plan filenames are used as chronology markers."
    ],
    "wikilink_patterns": [
      "Markdown links connect related docs and API references.",
      "Plans often mention related implementation surfaces without explicit backlinks."
    ],
    "backlink_patterns": [
      "Backlinks are implicit through filenames and repeated headings.",
      "Plugin docs reference API packages and manifest docs from several directions."
    ],
    "stale_contradictory_duplicated_patterns": [
      "Multiple dated design plans supersede earlier implementation notes.",
      "Localized user-flow docs intentionally duplicate canonical guide structure.",
      "Runtime setup docs and README overlap on opencode integration details."
    ],
    "privacy_boundary": [
      "Repository docs contain no dogfood vault notes.",
      "Benchmark must not commit provider payloads, secrets, or private user notes.",
      "Local-only profile observations must be summarized structurally."
    ],
    "task_pattern_examples": [
      "Find the latest plan that supersedes an earlier design note.",
      "Compare plugin manifest fields across developer docs.",
      "Summarize runtime setup constraints with source paths."
    ]
  },
  "workflow_templates": [
    "Find the authoritative setup note among repeated docs.",
    "Connect a dated plan to the current product surface.",
    "Preserve provenance when creating a generated wiki summary."
  ],
  "fixture_influence": [
    "Dated project and daily notes in the fixture.",
    "Generated wiki pages with source_paths frontmatter.",
    "Boundary tasks around local-first vault access and provider payload exclusion."
  ],
  "safety_review": {
    "raw_private_content_committed": false,
    "provider_payloads_committed": false,
    "reversible_anonymization_committed": false,
    "known_exclusions": [
      "No real dogfood notes",
      "No provider request or response payloads",
      "No credentials"
    ]
  }
}
